{
  "device_context": {
    "active_surface": "calendar_week_view",
    "is_focus_mode": false,
    "local_hour": 8
  },
  "events": [
    {
      "attendees": [],
      "calendar_id": "work",
      "category": "admin",
      "end": "2026-07-06T09:30:00-07:00",
      "event_id": "evt_seed_ea_dense_double_bookings_00",
      "is_flexible": true,
      "is_user_owned": true,
      "location": "",
      "notes": "",
      "start": "2026-07-06T09:00:00-07:00",
      "title": "Admin 1"
    },
    {
      "attendees": [
        "peer@example.com"
      ],
      "calendar_id": "work",
      "category": "external_meeting",
      "end": "2026-07-06T11:00:00-07:00",
      "event_id": "evt_seed_ea_dense_double_bookings_07",
      "is_flexible": false,
      "is_user_owned": false,
      "location": "Zoom",
      "notes": "",
      "start": "2026-07-06T10:30:00-07:00",
      "title": "External Meeting 8"
    },
    {
      "attendees": [
        "peer@example.com"
      ],
      "calendar_id": "work",
      "category": "external_meeting",
      "end": "2026-07-06T11:30:00-07:00",
      "event_id": "evt_seed_ea_dense_double_bookings_14",
      "is_flexible": false,
      "is_user_owned": false,
      "location": "Zoom",
      "notes": "",
      "start": "2026-07-06T11:00:00-07:00",
      "title": "External Meeting 15"
    },
    {
      "attendees": [
        "peer@example.com"
      ],
      "calendar_id": "work",
      "category": "external_meeting",
      "end": "2026-07-06T13:00:00-07:00",
      "event_id": "evt_seed_ea_dense_double_bookings_21",
      "is_flexible": false,
      "is_user_owned": false,
      "location": "Zoom",
      "notes": "",
      "start": "2026-07-06T12:30:00-07:00",
      "title": "External Meeting 22"
    },
    {
      "attendees": [
        "peer@example.com"
      ],
      "calendar_id": "work",
      "category": "external_meeting",
      "end": "2026-07-06T16:30:00-07:00",
      "event_id": "evt_seed_ea_dense_double_bookings_28",
      "is_flexible": false,
      "is_user_owned": false,
      "location": "Zoom",
      "notes": "",
      "start": "2026-07-06T16:00:00-07:00",
      "title": "External Meeting 29"
    },
    {
      "attendees": [],
      "calendar_id": "work",
      "category": "admin",
      "end": "2026-07-06T18:00:00-07:00",
      "event_id": "evt_seed_ea_dense_double_bookings_35",
      "is_flexible": true,
      "is_user_owned": true,
      "location": "",
      "notes": "",
      "start": "2026-07-06T17:30:00-07:00",
      "title": "Admin 36"
    },
    {
      "attendees": [
        "peer@example.com"
      ],
      "calendar_id": "work",
      "category": "internal_meeting",
      "end": "2026-07-07T10:00:00-07:00",
      "event_id": "evt_seed_ea_dense_double_bookings_01",
      "is_flexible": false,
      "is_user_owned": false,
      "location": "Zoom",
      "notes": "",
      "start": "2026-07-07T09:30:00-07:00",
      "title": "Internal Meeting 2"
    },
    {
      "attendees": [
        "peer@example.com"
      ],
      "calendar_id": "work",
      "category": "internal_meeting",
      "end": "2026-07-07T10:30:00-07:00",
      "event_id": "evt_seed_ea_dense_double_bookings_08",
      "is_flexible": false,
      "is_user_owned": false,
      "location": "Zoom",
      "notes": "",
      "start": "2026-07-07T10:00:00-07:00",
      "title": "Internal Meeting 9"
    },
    {
      "attendees": [
        "team@example.com"
      ],
      "calendar_id": "work",
      "category": "internal_meeting",
      "end": "2026-07-07T11:30:00-07:00",
      "event_id": "evt_team_sync",
      "is_flexible": true,
      "is_user_owned": false,
      "location": "Zoom",
      "notes": "",
      "start": "2026-07-07T11:00:00-07:00",
      "title": "Team sync"
    },
    {
      "attendees": [],
      "calendar_id": "work",
      "category": "admin",
      "end": "2026-07-07T12:00:00-07:00",
      "event_id": "evt_seed_ea_dense_double_bookings_15",
      "is_flexible": true,
      "is_user_owned": true,
      "location": "",
      "notes": "",
      "start": "2026-07-07T11:30:00-07:00",
      "title": "Admin 16"
    },
    {
      "attendees": [
        "peer@example.com"
      ],
      "calendar_id": "work",
      "category": "internal_meeting",
      "end": "2026-07-07T12:30:00-07:00",
      "event_id": "evt_seed_ea_dense_double_bookings_22",
      "is_flexible": false,
      "is_user_owned": false,
      "location": "Zoom",
      "notes": "",
      "start": "2026-07-07T12:00:00-07:00",
      "title": "Internal Meeting 23"
    },
    {
      "attendees": [
        "peer@example.com"
      ],
      "calendar_id": "work",
      "category": "internal_meeting",
      "end": "2026-07-07T17:00:00-07:00",
      "event_id": "evt_seed_ea_dense_double_bookings_29",
      "is_flexible": false,
      "is_user_owned": false,
      "location": "Zoom",
      "notes": "",
      "start": "2026-07-07T16:30:00-07:00",
      "title": "Internal Meeting 30"
    },
    {
      "attendees": [
        "peer@example.com"
      ],
      "calendar_id": "work",
      "category": "internal_meeting",
      "end": "2026-07-07T17:30:00-07:00",
      "event_id": "evt_seed_ea_dense_double_bookings_36",
      "is_flexible": false,
      "is_user_owned": false,
      "location": "Zoom",
      "notes": "",
      "start": "2026-07-07T17:00:00-07:00",
      "title": "Internal Meeting 37"
    },
    {
      "attendees": [
        "peer@example.com"
      ],
      "calendar_id": "work",
      "category": "internal_meeting",
      "end": "2026-07-08T09:30:00-07:00",
      "event_id": "evt_seed_ea_dense_double_bookings_02",
      "is_flexible": false,
      "is_user_owned": false,
      "location": "Zoom",
      "notes": "",
      "start": "2026-07-08T09:00:00-07:00",
      "title": "Internal Meeting 3"
    },
    {
      "attendees": [
        "peer@example.com"
      ],
      "calendar_id": "work",
      "category": "internal_meeting",
      "end": "2026-07-08T11:00:00-07:00",
      "event_id": "evt_seed_ea_dense_double_bookings_09",
      "is_flexible": false,
      "is_user_owned": false,
      "location": "Zoom",
      "notes": "",
      "start": "2026-07-08T10:30:00-07:00",
      "title": "Internal Meeting 10"
    },
    {
      "attendees": [
        "peer@example.com"
      ],
      "calendar_id": "work",
      "category": "internal_meeting",
      "end": "2026-07-08T11:30:00-07:00",
      "event_id": "evt_seed_ea_dense_double_bookings_16",
      "is_flexible": false,
      "is_user_owned": false,
      "location": "Zoom",
      "notes": "",
      "start": "2026-07-08T11:00:00-07:00",
      "title": "Internal Meeting 17"
    },
    {
      "attendees": [
        "peer@example.com"
      ],
      "calendar_id": "work",
      "category": "internal_meeting",
      "end": "2026-07-08T13:00:00-07:00",
      "event_id": "evt_seed_ea_dense_double_bookings_23",
      "is_flexible": false,
      "is_user_owned": false,
      "location": "Zoom",
      "notes": "",
      "start": "2026-07-08T12:30:00-07:00",
      "title": "Internal Meeting 24"
    },
    {
      "attendees": [],
      "calendar_id": "work",
      "category": "admin",
      "end": "2026-07-08T14:30:00-07:00",
      "event_id": "evt_admin_hold",
      "is_flexible": true,
      "is_user_owned": true,
      "location": "",
      "notes": "",
      "start": "2026-07-08T13:30:00-07:00",
      "title": "Flexible admin hold"
    },
    {
      "attendees": [
        "client@example.com",
        "me@seed.example"
      ],
      "calendar_id": "work",
      "category": "external_meeting",
      "end": "2026-07-08T16:00:00-07:00",
      "event_id": "evt_pressure_external",
      "is_flexible": false,
      "is_user_owned": false,
      "location": "Zoom",
      "notes": "",
      "start": "2026-07-08T15:00:00-07:00",
      "title": "Executive Assistant Dense external review"
    },
    {
      "attendees": [],
      "calendar_id": "work",
      "category": "admin",
      "end": "2026-07-08T16:30:00-07:00",
      "event_id": "evt_seed_ea_dense_double_bookings_30",
      "is_flexible": true,
      "is_user_owned": true,
      "location": "",
      "notes": "",
      "start": "2026-07-08T16:00:00-07:00",
      "title": "Admin 31"
    },
    {
      "attendees": [
        "peer@example.com"
      ],
      "calendar_id": "work",
      "category": "internal_meeting",
      "end": "2026-07-08T18:00:00-07:00",
      "event_id": "evt_seed_ea_dense_double_bookings_37",
      "is_flexible": false,
      "is_user_owned": false,
      "location": "Zoom",
      "notes": "",
      "start": "2026-07-08T17:30:00-07:00",
      "title": "Internal Meeting 38"
    },
    {
      "attendees": [
        "peer@example.com"
      ],
      "calendar_id": "work",
      "category": "internal_meeting",
      "end": "2026-07-09T10:00:00-07:00",
      "event_id": "evt_seed_ea_dense_double_bookings_03",
      "is_flexible": false,
      "is_user_owned": false,
      "location": "Zoom",
      "notes": "",
      "start": "2026-07-09T09:30:00-07:00",
      "title": "Internal Meeting 4"
    },
    {
      "attendees": [],
      "calendar_id": "work",
      "category": "admin",
      "end": "2026-07-09T10:30:00-07:00",
      "event_id": "evt_seed_ea_dense_double_bookings_10",
      "is_flexible": true,
      "is_user_owned": true,
      "location": "",
      "notes": "",
      "start": "2026-07-09T10:00:00-07:00",
      "title": "Admin 11"
    },
    {
      "attendees": [
        "peer@example.com"
      ],
      "calendar_id": "work",
      "category": "internal_meeting",
      "end": "2026-07-09T12:00:00-07:00",
      "event_id": "evt_seed_ea_dense_double_bookings_17",
      "is_flexible": false,
      "is_user_owned": false,
      "location": "Zoom",
      "notes": "",
      "start": "2026-07-09T11:30:00-07:00",
      "title": "Internal Meeting 18"
    },
    {
      "attendees": [
        "peer@example.com"
      ],
      "calendar_id": "work",
      "category": "internal_meeting",